YearAndSession,BillNumber,Title,Synopsis,bill_summary,programmatic,program_start_year,program_end_year,funding,responsible_party,stakeholders
2026 Regular Session,HB0228,Horse Racing - Prohibited Acts - Slaughter of Racehorses for Commercial Purposes,"Prohibiting a person from slaughtering or causing the slaughter of a racehorse in the State for certain commercial purposes; prohibiting a person from purchasing, selling, transferring, offering for sale, importing into the State, or transporting a racehorse if the person knows or reasonably should know that the racehorse will be slaughtered for certain commercial purposes; requiring certain fines collected by the State Racing Commission to be distributed to the racing Special Fund; etc.","This bill prohibits the slaughter of racehorses for commercial purposes, including for human or animal consumption, within Maryland. It further prohibits the purchase, sale, transfer, or transport of racehorses intended for commercial slaughter and establishes criminal penalties for violations. The State Racing Commission and the State Department of Agriculture are authorized to revoke or suspend the licenses of violators, and all fines collected under these provisions are to be distributed to the racing Special Fund.",False,,,,State Racing Commission and the State Department of Agriculture,"Racehorse owners, breeders, trainers, licensed veterinarians, and entities involved in the Maryland horse racing industry."
2026 Regular Session,HB0229,Maryland Transportation Authority - Revenue Bond Limit - Increase,"Increasing, from $4,000,000,000 to $5,000,000,000, the limit on the amount of certain revenue bonds that the Maryland Transportation Authority may have outstanding and unpaid on June 30 each year; etc.",This bill increases the limit on the aggregate outstanding and unpaid principal balance of revenue bonds secured by toll revenue that the Maryland Transportation Authority may have from $4 billion to $5 billion.,False,,,,Maryland Transportation Authority,Maryland Transportation Authority and users of Maryland's transportation infrastructure and toll facilities.
2026 Regular Session,HB0230,Transportation - Consolidated Transportation Program - Prioritization (Transportation Investment Priorities Act of 2026),"Altering the required elements of the Consolidated Transportation Program; requiring the Department of Transportation to develop a certain project-based scoring system, identify certain funds available for certain purposes, and solicit requests from certain entities for certain projects; requiring the Department to evaluate and score certain major surface transportation projects; altering the makeup, chair, frequency of meetings, and responsibilities of the Maryland Transportation Commission; etc.","The Transportation Investment Priorities Act of 2026 requires the Maryland Department of Transportation to develop and implement a project-based scoring system to evaluate and prioritize major surface transportation projects for inclusion in the Consolidated Transportation Program. The bill also modifies the composition and duties of the Maryland Transportation Commission, requiring it to review transportation policy, budget updates, and the project-scoring guidelines.",True,2026.0,,,Maryland Department of Transportation,"Maryland residents, local government jurisdictions, transit agencies, and metropolitan planning organizations."
2026 Regular Session,HB0231,Higher Education - Guaranteed Access Grant Program - Applicability,Delaying the decentralization of the Guaranteed Access Grant Program until the 2029-2030 financial aid award year.,This bill delays the decentralization of the Guaranteed Access Grant Program until the 2029–2030 financial aid award year. It shifts the timeline for when Maryland institutions of higher education will take over the process of offering grant awards based on state-certified lists and receiving reimbursements from the state Office of Student Financial Assistance.,False,2029.0,,,Maryland Higher Education Commission,Maryland institutions of higher education and students applying for Guaranteed Access Grants
2026 Regular Session,HB0232,Maryland Military Department – National Guard – Tuition Assistance,"Expanding the institutions to include trade, or career schools recognized by the Maryland Higher Education Commission or the Maryland Apprenticeship and Training Council and the types of expenses in connection with which tuition assistance may be provided for certain eligible Maryland National Guard service members.","This bill expands the Maryland National Guard tuition assistance program by adding coverage for training assistance expenses, such as tools, uniforms, and certification costs, and broadening the eligibility of private vocational and career schools recognized by the state.",False,2026.0,,,Maryland Military Department,Active members of the Maryland National Guard
2026 Regular Session,HB0233,Education - Public School Construction - Alterations,Clarifying the type of proposals and plans that require the approval of the State Superintendent of Schools; requiring a county board of education to request and receive approval from the State Superintendent before a county board may proceed with certain actions; authorizing the Interagency Commission on School Construction to adopt requirements for eligibility for certain State funding; repealing the requirement for the Commission to approve 75% of the preliminary school construction allocation by a certain date; etc.,"This bill modifies and clarifies the administrative and regulatory processes for public school construction projects in Maryland. It specifies that the State Superintendent must approve proposals for school sites or renovations exceeding $1,000,000 that affect student-occupied spaces, increases the threshold for requiring change order approvals to $200,000, and updates the reporting timelines and assessment protocols for the Interagency Commission on School Construction. The act also establishes an appeal process for local jurisdictions regarding project funding and clarifies rules regarding state debt service reimbursement for schools no longer used for educational purposes.",False,2026.0,,,Interagency Commission on School Construction and the State Superintendent of Schools,"County boards of education, local jurisdictions, and Maryland public school students"
2026 Regular Session,HB0234,Public Safety - Police Employees and Deputy State Fire Marshals - Repeal of Pay Rate Restriction on Promotion,Repealing a requirement that a certain police employee or deputy State fire marshal is entitled to a certain pay rate on promotion to a higher rank if a certain other police employee or deputy State fire marshal in the same rank is at a lower pay rate.,"This bill repeals a restriction on pay rates for Maryland State Police employees and deputy State fire marshals upon promotion. Specifically, it eliminates a rule that required a promoted employee to be placed in a lower pay step if their previous step was higher than that of an existing employee in the same rank who had equal or more total service time.",False,,,,Maryland Department of State Police,Maryland State Police employees and Deputy State Fire Marshals
2026 Regular Session,HB0235,Housing and Community Development - Neighborhood Business Development Program - Local Approval Requirement,Repealing a certain requirement for approval by a political subdivision of a certain application for financial assistance under the Neighborhood Business Development Program from the Department of Housing and Community Development.,"This bill removes the requirement that a local political subdivision must approve an application for financial assistance from the Neighborhood Business Development Program before the Department of Housing and Community Development can approve it. The Department is still required to provide written notice to the local political subdivision, but the affirmative resolution or letter of support is no longer necessary for the application to proceed.",False,2026.0,,,Maryland Department of Housing and Community Development,"Small businesses, nonprofit organizations, microenterprises, and local political subdivisions in Maryland."
2026 Regular Session,HB0236,State Athletic Commission - Blood Testing of Contestants - Timing,"Extending from 30 to 90 days the period of time before applying for a license to participate in a boxing, kick boxing, wrestling, or mixed martial arts contest and before participating in the contest during which certain blood testing may be conducted for purposes of submission of the results to the State Athletic Commission.","This bill extends the timeframe for required blood testing for boxing, kickboxing, wrestling, and mixed martial arts contestants. It increases the validity period of tests for HIV, Hepatitis B, and Hepatitis C from 30 days to 90 days prior to a license application or participation in a contest.",False,2026.0,,,State Athletic Commission,"Contestants in boxing, kickboxing, wrestling, and mixed martial arts competitions"
2026 Regular Session,HB0237,Commercial Law - Earned Wage Access - Revisions,Prohibiting a lender from accepting a tip from a consumer or giving a consumer the option to provide a tip; altering the timeline for certain refunds; subjecting certain earned wage access providers and loan lenders to certain consumer loan requirements; etc.,"This bill prohibits lenders and earned wage access (EWA) providers from accepting tips or offering tipping options to consumers. It reduces the timeframe for lenders to return received tips to consumers from 30 days to 7 days and subjects EWA providers to specific consumer loan regulations. Additionally, EWA providers are required to offer at least one no-cost service option and must disclose that they are legally prohibited from accepting tips or gratuities.",False,2026.0,,,Maryland Department of Labor,"Consumers using earned wage access services and consumer loans, and financial lenders and earned wage access providers."
2026 Regular Session,HB0238,Maryland Heritage Area Authority and Heritage Areas - Alterations,Altering the voting membership of the Maryland Heritage Area Authority; increasing the number of voting members of the Authority that constitutes a quorum from 9 to 10; repealing the requirement that the Authority send copies of boundary maps to certain county clerks; etc.,"This bill modifies the composition and operations of the Maryland Heritage Area Authority by adding new members, adjusting quorum requirements, and streamlining the ways state agencies support heritage areas. It also provides the Authority with greater flexibility in awarding grants and loans for the preservation and revitalization of certified heritage areas by removing specific matching fund caps and allowing the Authority to establish its own terms for financial assistance.",False,2026.0,,,Maryland Heritage Area Authority,"Maryland local jurisdictions, state departments (including Planning, Agriculture, and Education), heritage area management entities, and organizations focused on historic preservation and heritage tourism."
2026 Regular Session,HB0239,Land Use - Zoning - Limitations (Starter and Silver Homes Act of 2026),"Prohibiting local jurisdictions from adopting or enforcing certain zoning provisions relating to lot size, dimensions, setback requirements, lot coverage, and design or architectural elements for certain single-family homes; prohibiting local jurisdictions from prohibiting certain housing types in certain zones; and prohibiting local jurisdictions from prohibiting certain subdivisions of certain lot types.","The Starter and Silver Homes Act of 2026 limits the authority of local jurisdictions to impose certain zoning restrictions on single-family homes and townhouses. Specifically, it prohibits local laws from requiring lot sizes larger than 5,000 square feet in areas with public water and sewer, limits building setbacks, and prevents the enforcement of specific architectural design elements. Additionally, the bill allows property owners to subdivide improved lots in single-family zones into up to three smaller lots and prohibits local governments from banning townhouses in areas zoned for single-family residential use.",False,2026.0,,,Local legislative bodies and the Maryland Department of Housing and Community Development,"Maryland residents, property owners in single-family residential areas, housing developers, and local government jurisdictions"
2026 Regular Session,HB0240,Local Comprehensive Plans - Guidance Materials and Notification to the Department of Planning,"Requiring a local planning commission to notify the Department of Planning when beginning the review of the local jurisdiction's comprehensive plan; requiring the Department, within 60 days of receiving the notification, to provide guidance materials relating to State law, best practices for local comprehensive plans, and any other resources to support the plan's review; and requiring the Department to develop and maintain certain guidance materials in consultation with certain other State agencies and offices.","This bill requires local planning commissions to notify the Maryland Department of Planning when they begin reviewing or revising their comprehensive plans. Within 60 days of such notification, the Department of Planning must provide guidance materials, best practices, and other resources to assist the local jurisdiction. The bill also updates terminology in land use law by replacing the term 'visions' with 'planning principles.'",False,2026.0,,,Maryland Department of Planning,"Local planning commissions, local jurisdictions, and the Maryland Department of Planning"
2026 Regular Session,HB0241,Business Occupations and Professions - State Boards and Commissions - Sunset Extensions,"Continuing the State Board of Barbers, the State Board of Cosmetologists, the State Board for Professional Land Surveyors, the State Commission of Real Estate Appraisers, Appraisal Management Companies, and Home Inspectors, and the State Board of Individual Tax Preparers in accordance with the provisions of the Maryland Program Evaluation Act (sunset law) by extending to July 1, 2032, the termination provisions relating to the statutory and regulatory authority of the boards and commission; etc.","This bill extends the termination dates for several state boards and commissions under the Maryland Department of Labor—including those for barbers, cosmetologists, professional land surveyors, real estate appraisers, appraisal management companies, home inspectors, and individual tax preparers—until July 1, 2032. It also mandates that the Department of Labor submit specific reports on these entities to the Joint Audit and Evaluation Committee by July 1, 2030.",False,2026.0,2032.0,,Maryland Department of Labor,"Barbers, cosmetologists, professional land surveyors, real estate appraisers, appraisal management companies, home inspectors, and individual tax preparers."
2026 Regular Session,HB0242,Unemployment Insurance - Confidentiality of Information,Altering requirements related to the confidentiality of unemployment insurance information to ensure compliance with federal law and regulations; altering existing confidentiality requirements related to inspection of employment records and claim information by agents of child support enforcement units; establishing exceptions to confidentiality requirements in accordance with federal law and regulations; etc.,"This bill updates Maryland's unemployment insurance laws to align with federal confidentiality regulations by defining confidential information and establishing strict protocols for its disclosure to public officials, child support enforcement units, and authorized third parties. It also sets criminal penalties for the unauthorized use or disclosure of this sensitive data by current or former employees of the Maryland Department of Labor and other data recipients.",False,2026.0,,,Maryland Department of Labor,"Unemployment insurance claimants, employers, and employees of the Maryland Department of Labor."
2026 Regular Session,HB0243,Land Use - Comprehensive and General Plans - Alteration of Elements,Altering the required elements of comprehensive and general plans for charter counties and other local jurisdictions; establishing requirements and guidelines for each element; and requiring certain State agencies to provide charter counties and other local jurisdictions with assistance and information relevant to the preparation of each element.,"This bill redefines and updates the mandatory elements required in comprehensive and general land use plans for Maryland's charter counties and other local jurisdictions. It replaces previous planning categories with eight specific elements: Land, Transportation, Housing, Economy, Equity, Resilience, Place, and Ecology. The bill outlines detailed requirements for each element and requires various State agencies, led by the Department of Planning, to provide data and technical assistance to local governments for their planning processes.",False,2026.0,,,Maryland Department of Planning,"Local governments (charter counties and municipal corporations), Maryland residents, commercial watermen, and residents of overburdened or underserved communities."
2026 Regular Session,HB0244,Natural Resources – Vessel Transfers – Transfer–on–Death Beneficiary Designation,Authorizing an individual who is the sole owner of a certain vessel to apply to the Department of Natural Resources to designate a beneficiary to take ownership of the vessel on the death of the owner; requiring a designated beneficiary who survives the owner of a vessel to apply to the Department for a new certificate of title for the vessel; and requiring an application for a certificate of title for a vessel to contain certain information.,"This bill allows a sole owner of a vessel to designate a beneficiary on the certificate of title who will receive ownership of the vessel upon the owner's death. It establishes the process for the owner to designate, change, or cancel a beneficiary and outlines the requirements for a surviving beneficiary to apply for a new title, including providing a death certificate and proof of identity.",False,2026.0,,,Maryland Department of Natural Resources,Individual vessel owners in Maryland and their designated beneficiaries
2026 Regular Session,HB0245,Maryland Energy Administration - Jane E. Lawton Conservation Loan Program and Maryland Strategic Energy Investment Fund,Transferring the Jane E. Lawton Conservation Loan Program from the Maryland Energy Administration to the Maryland Clean Energy Center; repealing the authority of the Maryland Energy Administration to adopt regulations to implement the Program; and altering reporting requirements for the Maryland Strategic Energy Investment Fund.,"This bill transfers the administration of the Jane E. Lawton Conservation Loan Program from the Maryland Energy Administration to the Maryland Clean Energy Center. It also modifies the reporting requirements for the Maryland Strategic Energy Investment Fund, specifying that the Maryland Energy Administration must account for disbursements exceeding $10,000 and estimate greenhouse gas emissions reductions resulting from program activities.",False,2026.0,,,Maryland Clean Energy Center,"Nonprofit organizations, local jurisdictions, Maryland State agencies, and eligible businesses."
2026 Regular Session,HB0246,Video Tolls - Class G (Trailer) Vehicles - Liability,"Establishing that the registered owner of a Class G (trailer) vehicle is liable to the Maryland Transportation Authority for payment of a video toll assessed at the time of passage through a toll collection facility, subject to certain standards and procedures for the transfer of liability.","This bill establishes that the registered owner of a Class G (trailer) vehicle is liable for paying video tolls incurred when passing through a toll collection facility. It defines the notification process for tolls due, sets procedures for contesting liability or transferring it to other parties such as lessees or operators of the towing vehicle, and allows for the suspension of vehicle registration for failure to pay.",False,2027.0,,,Maryland Transportation Authority and the Motor Vehicle Administration,"Registered owners, lessors, lessees, and operators of Class G (trailer) vehicles"
2026 Regular Session,HB0247,Chesapeake and Atlantic Coastal Bays Critical Area Protection Program - Variances - Alterations,Altering certain standards and requirements for variances from land use requirements under the Chesapeake and Atlantic Coastal Bays Critical Area Protection Program.,"This bill alters the standards and requirements for granting variances from land use regulations under the Chesapeake and Atlantic Coastal Bays Critical Area Protection Program. It establishes a rebuttable presumption that existing accessory structures demonstrate reasonable use, prohibits certain types of variance applications such as those for unauthorized uses or mitigation adjustments, and requires applicants to demonstrate a substantial need that is not based on convenience or financial advantage. Additionally, it mandates that local boards of appeals hear variance appeals on the record and grant deference to administrative findings of fact.",False,2026.0,,,Maryland Critical Area Commission and local jurisdictions,Property owners in the Chesapeake and Atlantic Coastal Bays Critical Area and local government zoning and appeals boards
2026 Regular Session,HB0248,"Motor Vehicle Administration - Identification Cards, Licenses, and Permits - Repeal of Color Photograph Requirement","Repealing the requirement that the photograph included on an identification card, a driver's license, or a moped operator's permit issued by the Motor Vehicle Administration be in color.","This bill repeals the requirement that photographs on Maryland identification cards, driver's licenses, and moped operator's permits be in color, allowing the Motor Vehicle Administration more flexibility in the photographic format of these documents.",False,,,,Motor Vehicle Administration,"Maryland residents applying for or renewing identification cards, driver's licenses, or moped operator's permits"
2026 Regular Session,HB0249,"Vehicle Laws - Automated Enforcement - Reciprocal Agreements, Arrangements, and Declarations","Altering the policy of the State regarding reciprocal vehicle registration agreements, arrangements, and declarations; and authorizing the Motor Vehicle Administrator to enter into reciprocal agreements, arrangements, or declarations to provide for reciprocal enforcement of violations recorded by traffic control signal monitoring systems and speed monitoring systems.","This bill authorizes the Maryland Motor Vehicle Administrator to enter into reciprocal agreements, arrangements, or declarations with other jurisdictions for the enforcement of traffic violations captured by automated systems, such as red-light and speed cameras. It grants the Motor Vehicle Administration the authority to refuse the registration or renewal of a motor vehicle for violations occurring in participating jurisdictions.",False,2026.0,,,Motor Vehicle Administrator,Motor vehicle owners and drivers in Maryland and other jurisdictions with reciprocal traffic enforcement agreements
2026 Regular Session,HB0250,Environment - Water Resources and Wetlands - Enforcement,"Authorizing the Department of the Environment to impose an administrative penalty for certain violations related to the appropriation or use of water and dam safety; repealing a certain limitation on the Department's authority to issue certain orders and send certain notices related to dam safety; authorizing the Department to impose an administrative penalty of up to $5,000 for each violation, not to exceed $100,000, for certain violations related to wetlands construction, modification, or development; etc.","This bill authorizes the Maryland Department of the Environment to impose administrative penalties for violations related to water resources, dam safety, and wetlands. It establishes penalty limits of up to $5,000 per violation with a $100,000 total cap, defines specific criteria for assessing these penalties, and requires the funds to be deposited into the Maryland Clean Water Fund or the Private Dam Repair Fund. The bill also expands the Department's authority to issue corrective orders and notices for dam safety violations by removing previous limitations.",False,2026.0,,,Maryland Department of the Environment,"Individuals and entities involved in water appropriation, dam operation, or wetlands development; local governments; and the Maryland Department of the Environment."
2026 Regular Session,HB0251,Vehicle Laws - Transfer of Used Vehicles - Repeal of Notarized Bill of Sale Requirement,Repealing the requirement that a notarized bill of sale be submitted to the Motor Vehicle Administration when transferring ownership of a certain used vehicle.,"This bill repeals the requirement that individuals submit a notarized bill of sale to the Maryland Motor Vehicle Administration when transferring ownership of a used vehicle, specifically in cases where the sale price is significantly lower than the vehicle's established retail value.",False,2026.0,,,Maryland Motor Vehicle Administration,Maryland residents buying or selling used vehicles through private (non-dealer) transactions
