YearAndSession,BillNumber,Title,Synopsis,bill_summary,programmatic,program_start_year,program_end_year,funding,responsible_party,stakeholders
2026 Regular Session,HB0001,"Investor-Owned Electric, Gas, and Gas and Electric Companies - Cost Recovery - Limitations","Prohibiting certain public service companies from recovering through rates any costs associated with paying certain employees a bonus unless the employee has a written contract executed by December 31, 2025, or the employee is covered by a valid collective bargaining agreement; prohibiting a certain public service company from recovering through rates any costs associated with a supervisor's annual compensation once the compensation exceeds a certain amount; etc.","This bill prohibits investor-owned electric and gas utility companies from recovering the costs of employee bonuses and high-level supervisor compensation through utility rates, with certain exceptions for existing contracts and collective bargaining agreements. It also requires these companies to adopt policies that limit expenditures on non-essential activities such as entertainment, office renovations, and staff development.",False,2026.0,,,Maryland Public Service Commission and the boards of directors of investor-owned public service companies,"Customers of investor-owned electric and gas companies, utility company employees and supervisors, and investor-owned public service companies."
2026 Regular Session,HB0002,Subtraction Modification - Public Safety Retirement Income,"Increasing, from $15,000 to $20,000, the amount allowed as a subtraction modification under the Maryland income tax for retirement income attributable to an individual's employment as a public safety employee; and applying the Act to all taxable years beginning after December 31, 2025.","This bill increases the Maryland income tax subtraction modification for retirement income received by certain public safety employees from $15,000 to $20,000. The modification applies to retired law enforcement officers, correctional officers, and fire, rescue, or emergency services personnel who are at least 55 years old.",False,2026.0,,,Comptroller of Maryland,"Retired public safety employees including law enforcement officers, correctional officers, and fire, rescue, or emergency services personnel who are at least 55 years of age."
2026 Regular Session,HB0003,Higher Education - Nonresident Tuition - Exemption for Dependents of State or Local Public Safety Employees (Maryland Fallen Heroes Tuition Benefits Act),Exempting financially dependent children of State or local public safety employees who die as a result of or in the course of performance of duties from paying out-of-state or out-of-county tuition at a public institution of higher education in the State.,"The Maryland Fallen Heroes Tuition Benefits Act exempts the financially dependent children of state or local public safety employees who died in the line of duty from paying out-of-state or out-of-county tuition at Maryland public institutions of higher education, regardless of the child's actual state or county of residence.",False,2026.0,,,Maryland Higher Education Commission,"Financially dependent children of deceased Maryland public safety employees, including firefighters, ambulance or rescue squad members, law enforcement officers, correctional officers, and members of the Maryland National Guard."
2026 Regular Session,HB0004,Vehicle Laws – Historic Motor Vehicles – Minimum Age,"Requiring that a motor vehicle be at least 25 years old in order to be eligible for registration as a historic motor vehicle; and requiring the Motor Vehicle Administration to reinstate, under certain circumstances, the historic motor vehicle registration of a motor vehicle that had its historic vehicle registration suspended or revoked as a result of the change to the definition of ""historic motor vehicle"" in Chapter 604 of 2025.","This bill changes the eligibility requirements for registering a vehicle as a historic motor vehicle by defining it as a vehicle that is at least 25 years old, rather than using a specific model year. It also requires the Motor Vehicle Administration to reinstate historic motor vehicle registrations that were suspended or revoked due to definition changes made in 2025 and establishes the registration fee schedule.",False,,,,Motor Vehicle Administration,Owners of historic motor vehicles and the Motor Vehicle Administration
2026 Regular Session,HB0005,Community Development - Maryland New Markets Development Program - Establishment,"Establishing the Maryland New Markets Development Program; requiring the Department of Housing and Community Development to administer the Program; authorizing a credit against the State insurance premium receipts tax and certain State insurance retaliatory taxes, fees, charges, and penalties for certain equity investments in certain community development entities; authorizing the Department to recapture a credit under certain circumstances; limiting the credit amounts that may be issued to $18,750,000 for any taxable year; etc.","This bill establishes the Maryland New Markets Development Program to be administered by the Department of Housing and Community Development. The program provides tax credits against the state insurance premium receipts tax and certain retaliatory taxes for business entities that make qualified equity investments in community development entities, which must then invest those funds into qualified active low-income community businesses located in Maryland.",True,2026.0,,18750000.0,Maryland Department of Housing and Community Development,"Insurance companies, Maryland Qualified Community Development Entities, and businesses located in low-income communities in Maryland."
2026 Regular Session,HB0006,Public Institutions of Higher Education - Pregnant and Parenting Students - Plan and Reporting,Requiring the Maryland Higher Education Commission to collect certain data regarding the parental status of students from each public institution of higher education in the State; requiring public institutions of higher education to collect and report certain demographic data from students; and requiring all public institutions of higher education to adopt a certain plan for pregnant and parenting students.,"This bill requires the Maryland Higher Education Commission to collect and report data regarding the parental status of students at public higher education institutions. It also mandates that these institutions adopt and publish plans to provide pregnant and parenting students with access to referral networks for healthcare, government assistance programs, and institutional accommodations.",True,2026.0,,,Maryland Higher Education Commission and public institutions of higher education,Pregnant and parenting students at public institutions of higher education in Maryland
2026 Regular Session,HB0007,"State Board of Examiners for Audiologists, Hearing Aid Dispensers, Speech-Language Pathologists, and Music Therapists - Authority to Issue Limited Licenses to Practice Music Therapy","Authorizing the State Board of Examiners for Audiologists, Hearing Aid Dispensers, Speech-Language Pathologists, and Music Therapists to issue a limited license to practice music therapy; providing the purpose of the limited license is to permit an individual to practice music therapy while completing certain licensing requirements; and allowing a licensee with a limited license to practice music therapy under the supervision of a fully licensed music therapist.","This bill authorizes the State Board of Examiners for Audiologists, Hearing Aid Dispensers, Speech–Language Pathologists, and Music Therapists to issue limited licenses to individuals practicing music therapy. A limited license allows an applicant who has met all requirements except the examination to practice under the supervision of a fully licensed music therapist for a one-year term, renewable once. The bill establishes application procedures, fees, and requirements for these limited licenses.",False,2026.0,,,"State Board of Examiners for Audiologists, Hearing Aid Dispensers, Speech–Language Pathologists, and Music Therapists","Prospective music therapists, licensed music therapists, and the State Board of Examiners for Audiologists, Hearing Aid Dispensers, Speech–Language Pathologists, and Music Therapists"
2026 Regular Session,HB0008,Vehicle Laws - Dangerous Driver Abatement Program - Establishment (Dangerous Driver Accountability Act),Establishing the Dangerous Driver Abatement Program; establishing the purpose of the Program is to reduce motor vehicle-related deaths by requiring repeat offenders to complete a driver accountability and safety course or be subject to sanctions; requiring the Motor Vehicle Administration to administer the Program and provide a certain notice to repeat offenders; requiring a repeat offender to successfully complete a certain course within 90 days after receiving the notice; etc.,"This bill establishes the Dangerous Driver Abatement Program, administered by the Motor Vehicle Administration (MVA). It requires 'repeat offenders'—drivers who accumulate multiple violations via automated systems like speed cameras, red-light cameras, and school bus cameras within a 12-month period—to complete an approved driver accountability and safety course. Failure to complete the course within 90 days results in the suspension of vehicle registration renewals, and non-compliance after 180 days may lead to vehicle impoundment. The bill also provides fee waivers for low-income individuals and a hardship appeal process for essential workers.",True,2026.0,,,Maryland Motor Vehicle Administration (MVA),"Motor vehicle owners with multiple automated traffic violations, low-income drivers, essential workers, and the general public."
2026 Regular Session,HB0009,3-1-1 Systems - Expansion Program and Oversight Board - Establishment,Establishing the Maryland 3-1-1 Oversight Board in the Maryland Information Network to oversee the expansion of 3-1-1 systems in Maryland; establishing the 3-1-1 Program to use certain artificial intelligence to answer certain questions and route certain calls in certain counties; and requiring the expansion of the 3-1-1 Program to all of the counties in Maryland after a certain time period.,"This bill establishes the Maryland 3-1-1 Oversight Board and a 3-1-1 Program to modernize and expand nonemergency community information and referral systems across the state. The program will implement artificial intelligence technologies, including chatbots and voicebots, to answer public inquiries and route calls to appropriate government services. The initiative begins with a pilot phase in four counties and requires full statewide expansion by July 1, 2028.",True,2026.0,,,Maryland 3-1-1 Oversight Board,Maryland residents and local county governments
2026 Regular Session,HB0010,Legal Advertisement or Legal Notice - Publication in Newspaper or Newspaper in General Circulation - Digital Newspapers,"Establishing certain requirements for the print or digital publication of legal advertisements and notices in counties and municipalities in the State; requiring digital publications that publish a legal advertisement or notice to maintain an archive of all published legal advertisements and legal notices that shall be available to the public; and requiring digital publications that publish a legal advertisement or notice to employ at least one employee whose duties include reporting, writing, or editing local news and information.","This bill expands the definition of a newspaper or newspaper in general circulation for the publication of legal advertisements and notices to include digital publications. It establishes specific criteria for digital newspapers to qualify, including requirements for original content production, staffing of local residents, minimum publication frequency, and public archiving of notices.",False,2026.0,,,Maryland counties and municipalities,"Digital and print news organizations, Maryland residents, county and municipal governments, and legal parties required to publish public notices"
2026 Regular Session,HB0011,Anne Arundel County - Sheriff - Appointment of Majors,Requiring the Sheriff of Anne Arundel County to appoint three majors at a salary determined by the County Council of Anne Arundel County.,This bill requires the Sheriff of Anne Arundel County to appoint three majors with salaries determined by the County Council of Anne Arundel County.,False,2026.0,,,Sheriff of Anne Arundel County,Anne Arundel County Sheriff's Office and the County Council
2026 Regular Session,HB0012,Juvenile Sex Offender Registry - Qualifying Offenses and Access,Authorizing a local superintendent or the superintendent's designee to access the registry of juvenile sex offenders; and adding certain offenses to the list of offenses for which a person adjudicated delinquent is required to be included in the registry of juvenile sex offenders.,"This bill expands the list of criminal offenses for which a juvenile adjudicated delinquent must be included in the Maryland juvenile sex offender registry. It also authorizes local school superintendents or their designees to access the registry, which was previously limited to law enforcement personnel.",False,2026.0,,,Maryland Department of Juvenile Services,"Juveniles adjudicated delinquent for sex-related offenses, law enforcement personnel, and local school superintendents."
2026 Regular Session,HB0013,Income Tax - Subtraction Modification - Public Safety Employee Retirement Income (Supporting Our 9-1-1 Specialists Act),"Altering a certain subtraction modification under the Maryland income tax for retirement income attributable to an individual's employment as a public safety employee to include certain retirement income attributable to an individual's employment as a 9-1-1 specialist; and applying the Act to all taxable years beginning after December 31, 2025.","This bill expands the Maryland income tax subtraction modification for retirement income received by public safety employees to include 9-1-1 specialists. Eligible individuals who are at least 55 years old can subtract the first $15,000 of retirement income attributable to their service as a 9-1-1 specialist from their federal adjusted gross income when determining Maryland adjusted gross income.",False,2026.0,,,Comptroller of Maryland,Retired 9-1-1 specialists in Maryland aged 55 and older
2026 Regular Session,HB0014,"County Boards of Education - Bullying, Harassment, or Intimidation - Information Collection and Reporting Requirements","Altering the contents of a certain bullying, harassment, or intimidation form to require, if the incident is believed to have been motivated in whole or in substantial part by an actual or perceived personal characteristic including race, national origin, marital status, sex, sexual orientation, gender identity, religion, ancestry, physical attributes, socioeconomic status, familial status, or physical or mental ability or disability, the identification of those personal characteristics, if known; etc.","This bill requires county boards of education to update bullying, harassment, or intimidation report forms to include whether an incident was motivated by the victim's actual or perceived personal characteristics. It further mandates that each county board publish an annual summary of these reported incidents on its website by January 31 each year, disaggregated by the motivating personal characteristic, while ensuring individual identities remain confidential.",False,2026.0,,,Maryland State Department of Education and County Boards of Education,"Public school students, parents, guardians, and school staff in Maryland"
2026 Regular Session,HB0015,Public Information Act - Public Records - Nonprofit Organizations,"Altering the definition of a ""public record"" under the Public Information Act to include certain documentary material made by a nonprofit organization that receives $50,000 or more annually from State grants, State bond proceeds, or local impact grants; and altering the applicability of certain rules and limitations under the Public Information Act to include certain nonprofit organizations.","This bill expands the scope of the Maryland Public Information Act to include certain nonprofit organizations. Specifically, it defines documentary material produced or received by a nonprofit organization as a public record if the organization receives $50,000 or more annually from State grants, State bond proceeds, or local impact grants. Such organizations will be required to limit the personal information they collect to what is necessary for their governmental purpose and must adopt policies for the proactive disclosure of public records.",False,2026.0,,,Official custodians of records within covered nonprofit organizations and the Public Information Act Compliance Board,"Nonprofit organizations receiving at least $50,000 in annual State or local funding, employees of those organizations, and members of the public requesting access to records"
2026 Regular Session,HB0016,Correctional Services - Maryland Parole Commission - Members and Hearing Examiners,Altering the number of members of the Maryland Parole Commission from 10 to at least 15 but not more than 20 members; altering the appointing authority and method of appointment of parole commissioners; and repealing the authority of the Commission to appoint and utilize hearing examiners.,"This bill increases the size of the Maryland Parole Commission from 10 members to between 15 and 20 members and establishes a nomination panel to recommend candidates to the Governor for appointment. It also eliminates the use of hearing examiners, requiring that parole hearings be conducted by Commission members, and provides for the reallocation of salary funds from hearing examiners to commissioners.",False,2026.0,,,Maryland Parole Commission,"Incarcerated individuals, victims of crimes, and members of the Maryland Parole Commission"
2026 Regular Session,HB0017,Estates and Trusts - Venue for Administrative and Judicial Probate and Application of Inheritance Tax,"Altering certain criteria for determining the venue for administrative or judicial probate of decedents who were not domiciled in the State; providing that, for purposes of the application of the Maryland inheritance tax, the situs of intangible personal property is the domicile of the decedent; repealing a certain exemption from the Maryland inheritance tax for personal property that passes from a nonresident decedent; etc.","This bill modifies the legal requirements for determining the venue of probate for individuals who were not domiciled in Maryland at the time of their death. It also clarifies that for Maryland inheritance tax purposes, the location (situs) of intangible personal property is the decedent's place of domicile and repeals an inheritance tax exemption for certain personal property belonging to nonresident decedents.",False,,,,Maryland Comptroller and the Registers of Wills,"Nonresident decedents with property or interests in Maryland, beneficiaries of estates, and personal representatives."
2026 Regular Session,HB0018,Transportation Network Companies - Transportation Network Operators - Minimum Payments for Passenger Trips,"Requiring a transportation network company to pay operators, after July 1, 2026, and for any passenger trip originating in the State,  $1.66 per mile and $0.40 per minute, an additional $1.18 per mile for an operator using a wheelchair accessible vehicle, at least $5.00 for any passenger trip, and at least 80% of any cancellation fee charged by a transportation network company; and adjusting the minimum amount paid per mile and per minute by inflation each year.","This bill requires transportation network companies to provide minimum compensation to operators for passenger trips originating in Maryland. Starting July 1, 2026, companies must pay at least $1.66 per mile and $0.40 per minute, with a minimum trip payment of $5.00, and must also provide additional compensation for wheelchair-accessible vehicles and at least 80% of any cancellation fees. The bill also mandates annual inflation adjustments to these minimum rates based on the Consumer Price Index.",False,2026.0,,,Maryland Public Service Commission,"Transportation network companies, transportation network operators (drivers), and passengers in Maryland."
2026 Regular Session,HB0019,Higher Education - Maryland Public Service Loan Forgiveness Program - Establishment,"Establishing the Maryland Public Service Loan Forgiveness Program to assist in the repayment of higher education loans owed by State employees in order to attract, recruit, and retain these employees; requiring the Office of Student Financial Assistance within the Maryland Higher Education Commission to administer the Program; and requiring the Office to report to the General Assembly on or before January 1 of each year on the implementation of the Program and any effects the Program has on State employee recruitment or retention.","This bill establishes the Maryland Public Service Loan Forgiveness Program to provide higher education loan repayment assistance to State employees. To qualify, an employee must have graduated from a Maryland college or university and completed at least 10 years of service with the State. The program aims to improve recruitment and retention of State workers by providing awards up to 100% of their remaining loan debt, subject to the availability of funding.",True,2026.0,,,Office of Student Financial Assistance within the Maryland Higher Education Commission,"Maryland State employees in the executive, legislative, and judicial branches who graduated from Maryland institutions of higher education and have at least 10 years of state service."
2026 Regular Session,HB0020,Baltimore City - Alcoholic Beverages - Related Event Promoter's Permit,Reestablishing a related event promoter's permit in Baltimore City; authorizing the Board of License Commissioners for Baltimore City to issue a related event promoter's permit to certain applicants under certain circumstances; and requiring a holder of a State caterer's license to obtain a certain Class C per diem license from the Board before the holder may act as a participating license holder at a related event.,"This bill reestablishes the Related Event Promoter’s Permit in Baltimore City for social events related to the CIAA Basketball Tournament involving 75 or more participants. It requires promoters and participating license holders to obtain specific permits from the Board of License Commissioners for Baltimore City, mandates that state caterers obtain local per diem licenses, establishes application and permit fees based on venue capacity, and outlines penalties for non-compliance.",False,2026.0,2029.0,,Board of License Commissioners for Baltimore City,"Event promoters, Baltimore City alcoholic beverages license holders, State caterer's license holders, and organizers of events related to the CIAA Basketball Tournament."
2026 Regular Session,HB0021,Social Media Platforms - Vloggers and Video Content Featuring Minors (Child Influencers Protection Act),Requiring a vlogger who creates video content that is posted on a social media platform and features a certain child to compensate the child under certain circumstances; establishing requirements on social media platforms relating to deleting video content featuring minor children; and applying certain requirements relating to the labor of minors to children compensated by vloggers.,The Child Influencers Protection Act requires vloggers to compensate children who are featured in their social media content if certain viewership or revenue thresholds are met. Compensation must be placed into a trust for the child until they reach the age of 18. The bill also allows individuals who were featured in such content as children to request the permanent deletion of that content once they reach adulthood and ensures that Maryland child labor laws apply to these minors.,False,2026.0,,,Maryland Department of Labor,"Child influencers, vloggers, parents and guardians of child influencers, and social media platforms"
2026 Regular Session,HB0022,Correctional Services - Incarcerated Individuals - Identification Cards and Driver's Licenses,Requiring a certain correctional facility to return a certain identification card or driver's license to a certain incarcerated individual at or before the time of the individual's release from confinement under certain circumstances; requiring the Commissioner of Corrections and the managing official of a local correctional facility to provide certain forms and work with a certain incarcerated individual to ensure a certain identification card or driver's license is available at the time of release from confinement; etc.,"This bill requires State and local correctional facilities to return a valid photo identification card or driver's license to an incarcerated individual upon their release. It also mandates that, for individuals serving a sentence of one year or more, the Commissioner of Correction or the local facility's managing official must begin working with the individual six months prior to their anticipated release to ensure they have a valid Motor Vehicle Administration-issued identification card or driver's license at the time of release.",True,2026.0,,,Commissioner of Correction and the managing official of each local correctional facility,Incarcerated individuals in State and local correctional facilities
